{
  "$schema": "http://json-schema.org/draft-06/schema#",
  "$ref": "#/definitions/Page",
  "definitions": {
    "Page": {
      "type": "object",
      "additionalProperties": true,
      "properties": {
        "meta": {
          "type": "array",
          "items": {
            "type": "object"
          }
        },
        "config": {
          "type": "object"
        },
        "status": {
          "type": "boolean"
        },
        "message": {
          "type": "string"
        },
        "title": {
          "type": "string"
        },
        "uuid": {
          "type": "string",
          "format": "uuid"
        },
        "nid": {
          "type": "string"
        },
        "vid": {
          "type": "string"
        },
        "changed": {
          "type": "string"
        },
        "langcode": {
          "type": "string"
        },
        "label": {
          "type": "string"
        },
        "body": {
          "type": "array",
          "items": {
            "type": "object"
          }
        },
        "current": {
          "type": "boolean"
        },
        "dirty": {
          "type": "boolean"
        },
        "translation": {
          "type": "boolean"
        },
        "target": {
          "type": "string"
        },
        "time": {
          "type": ["string", "object"]
        }
      },
      "required": ["body", "title"],
      "title": "Page"
    }
  }
}
